Image,,English,Hindi,Kannada,Tamil,Telugu,Odia,Bengali,Assamese,Malayalam,Marathi,Gujarati,Urdu,Odia
5,A5,"Professional support is recommended when there is increased mental distress, along with limited coping and support resources. In some cases, mental health could suddenly worsen due to the pandemic. Few other signs that indicate the need for professional help are the presence of suicidal thoughts and increased duration and severity of the mental health concerns mentioned above. ","जब मानसिक परेशानी ज़्यादा हो और उससे निपटने तथा सहारे के साधन कम हों तब पेशेवर मदद लेने की सिफ़ारिश की जाती है। कुछ मामलों में, महामारी के कारण मानसिक स्‍वास्‍थ्‍य अचानक बिगड़ सकता है। अगर आत्‍महत्‍या के विचार ज़्यादा तीव्रता से आ रहे हों और ऊपर बताई गई मानसिक स्‍वास्‍थ्‍य संबंधी चिंताओं का समय बढ़ गया हो तब भी पेशेवर मदद लेने की ज़रूरत हो जाती है।
","ಹೆಚ್ಚಿನ ಮಾನಸಿಕ ತೊಂದರೆಗಳೊಂದಿಗೆ ಅವುಗಳನ್ನು ನಿಭಾಯಿಸಲು ಹೆಚ್ಚಿನ ಬೆಂಬಲದ ಸಂಪನ್ಮೂಲಗಳು ಇಲ್ಲದಿದ್ದಲ್ಲಿ ವೈದ್ಯಕೀಯ ಸಹಾಯ ಶಿಫಾರಸುಮಾಡಲಾಗುತ್ತದೆ. ಕೆಲವು ಸಂಧರ್ಭಗಳಲ್ಲಿ ಸಾಂಕ್ರಾಮಿಕ ರೋಗದ ಕಾರಣಗಳಿಂದಾಗಿ ಮಾನಸಿಕ ಆರೋಗ್ಯವು ಇದ್ದಕ್ಕಿದ್ದಂತೆ ಹದಗೆಡಬಹುದು. ಆತ್ಮಹತ್ಯಾ ಆಲೋಚನೆಗಳು ಮತ್ತು ಮೇಲೆ ತಿಳಿಸಿರುವ ಮಾನಸಿಕ ಆರೋಗ್ಯಕ್ಕೆ ಸಂಭದಿಸಿದ ಲಕ್ಷಣಗಳ ಅವಧಿ ಹಾಗೂ ತೀವ್ರತೆ ಹೆಚ್ಚುವುದು, ವೈದ್ಯಕೀಯ ಸಹಾಯದ ಅವಶ್ಯಕತೆಯನ್ನು ಸೂಚಿಸುತ್ತದೆ.","மட்டுப்படுத்தப்பட்ட சமாளிப்பு மற்றும் ஆதரவு ஆதாரங்களுடன் மன உளைச்சல் அதிகரிக்கும் போது தொழில்முறை ஆதரவு பரிந்துரைக்கப்படுகிறது. சில சந்தர்ப்பங்களில், தொற்றுநோய் காரணமாக மன ஆரோக்கியம் திடீரென்று மோசமடையக்கூடும். தொழில்முறை ஆதரவின் அவசியத்தைக் குறிக்கும் வேறு சில அறிகுறிகள் தற்கொலை எண்ணங்கள் அதிக தீவிரத்தோடு இருப்பது மற்றும் மேலே குறிப்பிட்டுள்ள மனநலக் கவலைகளின் அதிகரித்த காலம்","మానసిక ఆందోళనలు పెరిగిపోయి, వాటిని తట్టుకొనే శక్తి గానీ, సరిగ్గా చూసుకునే మనుషులు గానీ  కావలసిన విధంలో లేనప్పుడు నిపుణుల సహాయం తప్పక తీసుకోవడం మంచిది. కొందరి విషయంలో ఈ  కోవిడ్-19 మహమ్మారి వల్ల మానసిక పరిస్థితులు హటాత్తుగా దిగజారవచ్చు. ఆత్మహత్య గురించి పెరిగిన ఆలోచనలు, ఎక్కువైనా మానసిక ఆందోళనలు నిపుణుల్ని సంప్రదించాలి అనేందుకు కొన్ని ప్రముఖ చిహ్నాలు.   ",,"মানসিক চাপ বেশি থাকলে, এবং তাঁকে সাহায্য করার উপায় সীমিত থাকলে পেশাদার ডাক্তারের সাহায্য নেওয়া উচিত। অতিমারির জন্য মানসিক স্বাস্থ্য কোনও কোনো ক্ষেত্রে হঠাৎ করে খারাপ হতে পারে। আর যেসব ক্ষেত্রে ডাক্তারের সংগে যোগাযোগ করা দরকার সেগুলো হলোঃ যদি আত্মহত্যার চিন্তা থাকে, এবং উপরে উল্লিখিত লক্ষণগুলোর মাত্রা বেশি হলে অথবা বেশি সময় ধরে দেখা দিলে।  ",মানসিক চাপ অত্যধিক বৃদ্ধি হ'লে তথা আনৰ পৰা সাহায্য লাভ কৰাৰ সম্ভাৱনা কম থাকিলে বৃত্তিগত সহায়কাৰীৰ সাহায্য লোৱা উচিত। কোনো কোনো ক্ষেত্ৰত মহামাৰীৰ কাৰণে হঠাতে মানসিক স্ৱাস্থ্যৰ অৱনতি ঘটিব পাৰে। বৃত্তিগত সহায়কাৰীৰ সাহায্য ল'বলগীয়া হোৱা অৱস্থাৰ আন কেতবোৰ লক্ষণ হৈছে আত্মহত্যাৰ প্ৰৱণতা আৰু ওপৰত উল্লেখ কৰা মানসিক স্ৱাস্থ্যজনিত বিষয়সমূহ বহুদিনলৈ প্ৰবলভাৱে অব্যাহত থকাটো।,"ഏറിയ മാനസിക വൈഷമ്യം നേരിടാൻ ബുദ്ധിമുട്ടാകുമ്പോഴും, ആശ്രയത്തിന്നു പരിമിതമായ മാർഗ്ഗങ്ങൾ മാത്രം ഉള്ളപ്പോഴും വിദഗ്ദ്ധസഹായം തേടേണ്ടതാണ്. ചിലർക്ക്, പകർച്ചവ്യാധി കൊണ്ടുള്ള മനഃക്ലേശം കാരണം മാനസികാരോഗ്യം പെട്ടെന്ന് വഷളാകാം. പ്രബലമായ ആത്മഹത്യ ചിന്തകൾ, മേൽ പറഞ്ഞ മാനസികാരോഗ്യ പ്രശ്നങ്ങളുടെ ദൈർഘ്യം തുടങ്ങിയ ലക്ഷണങ്ങളും വിദഗ്ധ സഹായം തേടേണ്ട ആവശ്യം സൂചിപ്പിക്കുന്നു.","
जेव्हा मनावरचा ताण आणि मनःक्षोभ यांच्याशी सामना करता येणार नाही असं वाटायला लागतं, आणि कुटुंबीय/मित्रमंडळाकडून परदेशी मदत नसते तेव्हा मानसोपचारतज्ज्ञाची मदत घ्यावी. साथीच्या काळात ताणामुळे मानसिक अस्वास्थ्य अचानक बिघडू शकतं. मनात आत्महत्येचे विचार येत असतील, आणि ताणाची लक्षणं हाताबाहेर जात आहेत असं वाटलं तर मानसतज्ज्ञाशी तातडीनं संप्रेरक साधावा.","મર્યાદિત કંદોરો અને સપોર્ટ સ્રોતોની સાથે માનસિક ત્રાસ વધે ત્યારે વ્યવસાયિક સહાયની ભલામણ કરવામાં આવે છે. કેટલાક કિસ્સાઓમાં, રોગચાળાને કારણે માનસિક આરોગ્ય અચાનક વણસી શકે છે. થોડા અન્ય સંકેતો જે તજ્ઞ સહાયની જરૂરિયાત દર્શાવે છે તે આત્મહત્યા વિચારોની હાજરી અને ઉપર જણાવેલ માનસિક સ્વાસ્થ્યની ચિંતાની અવધિ અને તીવ્રતા છે.",,"ଯେତେବେଳେ ଗୋଟେ ବ୍ୟକ୍ତିଙ୍କ ମାନସିକ ଭାରସାମ୍ୟ ହ୍ରାସ ପାଏ ସେତେବେଳେ ତାଙ୍କୁ ବିଶେଷଜ୍ଞର ଆବଶ୍ୟକତା ପଡିଥାଏ । ଏହି ମହାମାରୀ ସମୟରେ କେତେକ ସ୍ଥଳରେ ଏମାନଙ୍କର ମାନସିକ ଭାରସାମ୍ୟ ହଠାତ୍ ହ୍ରାସ ପାଇଥାଏ । ଆଉ କେତେକ ଘଟଣାରେ ଏମାନଙ୍କର ଆତ୍ମହତ୍ୟା କରିବାର ଭାବନା ଜାଗରଣ ହୋଇଥାଏ, ଏପରି ସ୍ଥଳେ ବିଶେଷଜ୍ଞମାନଙ୍କ ଆବଶ୍ୟକତା ଅପରିହାର୍ଯ୍ୟ ।"
6,Q6,What can I do to help the elderly at home showing such symptoms? ,"अगर घर पर बुज़ुर्ग लोगों में ऐसे लक्षण दिख रहे हों तो मुझे क्‍या करना चाहिए? ",ಮನೆಯಲ್ಲಿರುವ ವೃದ್ಧರಲ್ಲಿ ಈ ಲಕ್ಷಣಗಳು ಕಾಣಿಸಿಕೊಂಡರೆ ನಾನು ಹೇಗೆ ಸಹಾಯ ಮಾಡಬಹುದು?,இதுபோன்ற அறிகுறிகளைக் காண்பிக்கும் வீட்டில் உள்ள வயதானவர்களுக்கு உதவ நான் என்ன செய்ய முடியும்?,ఇలాంటి లక్షణాలు ఇంటి దగ్గర ఉండే పెద్దవాళ్లలో కనిపిస్తే నేను ఏమి చేయగలను?,,বাড়িতে বয়স্কদের এই সব লক্ষণ থাকলে আমরা কী করতে পারি? ,ঘৰৰ বয়সস্থ লোক এজনে এনে লক্ষণ দেখুৱালে কি কৰা উচিত?,"വീട്ടിലെ പ്രായമായവരിൽ മാനസികാരോഗ്യ പ്രശനങ്ങളുടെ ലക്ഷണങ്ങൾ കണ്ടാൽ, അവരെ സഹായിക്കാൻ എനിക്ക് എന്ത് ചെയ്യാൻ കഴിയും?   ",माझ्या घरच्या कोणा वडीलधाऱ्यांमधे मानसिक ताण आणि अस्वास्थ्याची लक्षणं दिसत असली तर मी काय करू?,અમારા ઘર માં વડીલોને માનસિક તણાવથી બહાર લાવવા અમે કઈ રીતે મદદ કરી શકિયે?,,"ଘରେ ଥିବା ବୟସ୍କ ବ୍ୟକ୍ତିଙ୍କ ଠାରେ ଯଦି ଏହି ସବୁ ଲକ୍ଷଣ ଦେଖାଯାଉଥାଏ, ତାଙ୍କ ପାଇଁ ମୁଁ କଣ କରି ପାରିବି ?"
6,A6,"Offer reassurance and validation of mental health concerns during the pandemic. Find ways to offer support and connection by doing activities together, such as playing games or looking at old photographs, doing small chores together, introducing them to technology, helping them exercise regularly and getting professional help if things get worse.","महामारी के दौरान मानसिक स्‍वास्‍थ्‍य संबंधी चिंताओं के बारे में उन्‍हें आश्‍वस्‍त करें। उनकी मदद करने के तरीके खोजें और साथ मिलकर कुछ करने के ज़रिए उनसे जुड़ाव बढ़ाएँ जैसे गेम खेलना या पुराने फ़ोटोग्राफ देखना, घर के छोटे-मोटे काम मिलकर करना, उन्‍हें तकनीक से परिचित कराना, नियमित कसरत करने में उनकी मदद करना आदि। अगर स्थिति बिगड़ती है तो उन्‍हें पेशेवर मदद दिलवाना।
","ಸಾಂಕ್ರಾಮಿಕ ರೋಗದ ಸಮಯದಲ್ಲಿ ಮಾನಸಿಕ ಆರೋಗ್ಯದ ಕಾಳಜಿಗಳ ಬಗ್ಗೆ ಧೈರ್ಯ ಹಾಗೂ ಸಮ್ಮತಿಯನ್ನು ನೀಡಿ. ಒಟ್ಟಿಗೆ ಮಾಡುವ ಚಟುವಟಿಕೆಗಳಾದ - ಆಟ ಆಡುವುದು ಅಥವಾ ಹಳೆಯ ಫೋಟೋಗಳನ್ನು ನೋಡುವುದು, ಸಣ್ಣಪುಟ್ಟ ಕೆಲಸಗಳನ್ನು ಒಟ್ಟಿಗೆ ಮಾಡುವುದು, ಅವರಿಗೆ ತಂತ್ರಜ್ಞಾನದ ಪರಿಚಯ ಮಾಡಿಸುವುದು, ದಿನನಿತ್ಯ ವ್ಯಾಯಾಮ ಮಾಡಲು ಸಹಾಯ ಮಾಡುವುದು ಮತ್ತು ಪರಿಸ್ಥಿತಿ ಹದೆಗೆಟ್ಟಲ್ಲಿ ವೈದ್ಯಕೀಯ ಸಹಾಯ ಪಡೆಯುವುದರ ಮೂಲಕ ಸಂಪರ್ಕವನ್ನು ಮತ್ತು ಬೆಂಬಲವನ್ನು ನೀಡಲು ಪ್ರಯತ್ನಿಸಿ.","தொற்றுநோய்களின் சமயத்தில் மனநல கவலைகளை உறுதிப்படுத்துதல் மற்றும் சரிபார்த்தல் ஆகியவற்றை வழங்குதல். அவர்களோடு விளையாடுவடு அல்லது பழைய புகைப்படங்களைப் பார்ப்பது, சிறிய வேலைகளை ஒன்றாகச் செய்வது, தொழில்நுட்பத்தை அறிமுகப்படுத்துவது, தவறாமல் உடற்பயிற்சி செய்ய உதவுவது, செய்வதன் மூலம் ஆதரவையும் இணைப்பையும் வழங்குவதற்கான வழிகளைக் கண்டறியவும். மேலும் விஷயங்கள் மோசமாகிவிட்டால் தொழில்முறை உதவியைப் பெறுதல். ","ఈ  కోవిడ్-19 మహమ్మారి సమయంలో వారికి అభయమిచ్చే విధంగా మాట్లాడండి. వారికి మద్దతుగా ఉంటూ, బాంధవ్యం పెంచుకోడానికి మీరు చెయ్యగలిగే పనులలో కొన్ని: కలిసి ఆటలు ఆడటం, పాత ఫోటోలను చూడటం, చిన్న చిన్న పనులు కలిసి చెయ్యటం, వారికీ టెక్నాలజీ ని పరిచయం చేయడం, వారి రోజు వ్యాయామం సక్రమంగా జరిగేలా చెయ్యటం. కానీ పరిస్థితులు దిగజారితే మటుకు తప్పకుండ నిపుణుల సహాయం తీసుకోండి.",,"এই অতিমারির সময় তাঁদের আশ্বস্ত করুন এবং তাঁদের মানসিক অবস্থার কথা বোঝার চেষ্টা করুন। একসঙ্গে বসে করা যায় এমন কিছু কাজ, বা খেলা, অথবা একসঙ্গে বসে পুরনো ছবি দেখার কথা ভাবুন। তাঁদেরকে কিছু নতুন প্রযুক্তির সংগে পরিচয় করিয়ে দিন। নিয়মিত ব্যায়াম করতে সাহায্য করুন। অবস্থার অবনতি ঘটলে পেশাদার ডাক্তারের সংগে যোগাযোগ করুন।  ","মহামাৰীৰ সময়ত উদ্ৰেক হ'ব পৰা মানসিক স্ৱাস্থ্য সম্পৰ্কীয় বিষয়বোৰক গুৰুত্ব দি তেওঁলোকক আশ্বস্ত কৰক। তেওঁলোকৰ সৈতে একেলগে খেল খেলি নতুবা পুৰণি ফটো চাই, ঘৰৰ সৰু কাম-কাজ একেলগে কৰি, নানা বিধ আহিলাৰ সৈতে তেওঁলোকক পৰিচয় কৰাই দি, দৈনিক ব্যায়াম কৰাত সহায় কৰি আৰু প্ৰয়োজন হ'লে বৃত্তিগত সহায়কাৰীৰ সেৱা উপলব্ধ কৰি তেওঁলোকৰ বাবে সাহায্য আৰু যোগাযোগ নিশ্চিত কৰক।","ഈ മഹാമാരിയുടെ കാലത്തു  അവരുടെ ആരോഗ്യ പ്രശ്നങ്ങളെ സാധുകരിക്കുകയും അവരെ ധൈര്യപ്പെടുത്തുകയും ചെയ്യുക.  അവരോടൊത്ത് കളിക്കുക, പഴയ ഫോട്ടോകൾ നോക്കുക, ചെറിയ വീട്ടുജോലികൾ ചെയ്യുക, അവരെ പുതിയ സാങ്കേതികവിദ്യകളോട്  പരിചയപ്പെടുത്തുക, പതിവായി വ്യായാമം ചെയ്യാൻ ഉത്സാഹിപ്പിക്കുക, തുടങ്ങിയവ ചെയ്തു ബന്ധുത്വം പകരുകയും  ആശ്രയമേകുകയും ചെയ്യാം. കാര്യങ്ങൾ കൈകടന്നാൽ  വിദഗ്ധ സഹായം തേടുക. ","
त्यांना धीर द्यावा, त्यांना वाटणारी काळजी आणि नैराश्य अकारण नाही हे आवर्जून सांगावं. मन रिझेल, ताण कमी होईल आणि आधार वाटेल अशा एकत्र करता येण्याजोग्या गोष्टी आवर्जूूूून कराव्यात. उदाहरणार्थ, पत्ते खेळणं, जुने फोटो बघणं, घरातली कामं एकत्र करणं, नवीन तंत्रज्ञानाची ओळख करून देणं, जमेल तेवढा व्यायाम करायला मदत करणं, इत्यादि. मानसिक ताणाची आणि अस्वास्थ्याची लक्षणं कमी झाली नाहीत किंवा वाढली तर मानसतज्ज्ञाशी संपर्क साधावा.","આવા સમયે તેમને જે ગભરામણ થાય તે વ્યાજબી છે એટલે ધીરજથી એમને ધરપત આપવી પડશે. તમે એમની સાથે વાત કરી એમને સમજાવી શકો  કે બધૂ જલદી સારું થઈ જશે.એમની સાથે સમય વિતાવો, ઘરમાં સાથે કામ કરો, જુના ફોટાનું આલ્બમ સાથે બેસીને જોવાનું,  ટીવીના પ્રોગ્રામ, ફિલ્મ, સાથે જુઓ, સંગીત સાંભળો, સાથે કસરત કરો, એમને ખુશ અને સકારત્મક  રાખો જો તેમના નકારાત્મક લક્ષણો વધવા લાગે તો માનસિક તજ્ઞની મદદ લેવી જરૂરી છે. ",,"ମାନସିକ ସୁସ୍ଥତା ବଜାୟ ରଖିବା ପାଇଁ ନିଶ୍ଚିତ କରାନ୍ତୁ । ତାଙ୍କ ସହ ଅଧିକ ସମୟ ଅତିବାହିତ କରନ୍ତୁ, ମିଶିକି କିଛି ଖେଳନ୍ତୁ, ପୁରୁଣା ଫଟୋ ଦେଖାନ୍ତୁ, ଗୀତ ଗାଆନ୍ତୁ, ତାଙ୍କୁ ନୂଆ ଟେକ୍ଲୋଲୋଜି (ଜ୍ଞାନ କୌଶଳ) ବିଷୟରେ କୁହନ୍ତୁ । ତାଙ୍କୁ ନିୟମିତ ଭାବେ ବ୍ୟାୟାମ କରିବାରେ ସାହାଯ୍ୟ କରନ୍ତୁ ଏବଂ ଦରକାର ପଡ଼ିଲେ ବିଶେଷଜ୍ଞଙ୍କୁ ପରାମର୍ଶ କରାନ୍ତୁ ।"