Image,,English,Hindi,Kannada,Tamil,Telugu,Odia,Bengali,Assamese,Malayalam,Marathi,Gujarati,Urdu,Odia
3,A3,"In their struggle to cope with the current situation, the elderly might experience disturbances in sleep patterns and appetite. They could worry and be anxious about death or illness. Uncertainty about the future, hopelessness and/or helplessness, sadness, loss of interest, motivation and energy could be other signs of mental health concerns.","मौजूदा हालात के साथ सामंजस्‍य बैठाने की परेशानी के कारण बुज़ुर्ग लोगों को नींद आने और भूख लगने में समस्‍या हो सकती है। उनमें बीमार पड़ने या मृत्‍यु को लेकर डर और घबराहट पैदा हो सकती है। भविष्‍य को लेकर अनिश्चितता, निराशा या असहायता, उदासी, किसी चीज़ या कुछ चीज़ों में रुचि न लेना, कुछ करने का उत्‍साह और शरीर में ऊर्जा न महसूस करना ऐसी अन्‍य निशानियाँ हो सकती हैं जिनसे मानसिक स्‍वास्‍थ्‍य संबंधी चिंताओं का पता चलता है।","ಕೋವಿಡ್ ೧೯ನಿಂದ ಉಂಟಾಗಿರುವ ಪರಿಸ್ಥಿತಿಗಳನ್ನು ನಿಭಾಯಿಸುವ ಕಷ್ಟದಿಂದ ವೃದ್ಧರು ನಿದ್ರೆ ಮತ್ತು ಹಸಿವಿನಲ್ಲಿ ಅಡಚಣೆಗಳನ್ನು ಅನುಭವಿಸಬಹುದು. ರೋಗ ಅಥವಾ ಸಾವಿನ ಬಗೆಗಿನ ಚಿಂತೆ ಮತ್ತು ಆತಂಕಕ್ಕೊಳಗಾಗಬಹುದು. ಭವಿಷ್ಯದ ಅನಿಶ್ಚಿತತೆ, ಹತಾಶತೆ ಅಥವಾ ಅಸಹಾಯಕತೆ, ದುಃಖ, ಆಸಕ್ತಿ, ಉತ್ತೇಜನೆ ಮತ್ತು ಶಕ್ತಿ ಕಳೆದುಕೊಳ್ಳುವುದು, ಇವೆಲ್ಲ ಮಾನಸಿಕ ಆರೋಗ್ಯಕ್ಕೆ  ಸಂಬಂಧಿಸಿದ ಲಕ್ಷಣಗಳ ಗುರುತುಗಳಾಗಿರಬಹುದು. ","தற்போதைய சூழ்நிலையைச் சமாளிப்பதற்கான அவர்களின் போராட்டத்தில், வயதானவர்கள் தூக்க முறைகள் மற்றும் பசியின்மை ஆகியவற்றில் தொந்தரவுகளை சந்திக்க நேரிடும். அவர்கள் இறப்பது அல்லது நோய் பற்றி கவலைப்படலாம். எதிர்காலத்தைப் பற்றிய நிச்சயமற்ற தன்மை, நம்பிக்கையற்ற தன்மை மற்றும் உதவியற்ற தன்மை, சோகம், ஆர்வம் இழப்பு, உந்துதல் மற்றும் ஆற்றல்  இழப்பு ஆகியவை மனநலக் கவலைகளைக் குறிக்க மற்ற அறிகுறிகளாக இருக்கலாம்."," కోవిడ్-19 వల్ల , ప్రస్తుత పరిస్థితులను ఎదుర్కునే ప్రయాసలో, వృద్దులకు నిద్రలోనూ ఆకలిలోనూ అలజడి కలుగవచ్చు. వారు తమ ఆరోగ్యం గురించి గాని, మరణం గురించి గాని ఆలోచిస్తూ ఆందోళన పడుతూ ఉండవచ్చు. భవిష్యత్తు యొక్క అనిశ్చిత గురించి ఆలోచిస్తూ, వారు తీవ్రమైన నిరాశను, వ్యాకులమును అనుభవిస్తూ, ప్రేరణను పోగొట్టుకొవడం లాంటిటివి  వారి మానసిక ఆరోగ్య సమస్యలను తెలిపే చిహ్నాలు. ",,"বর্তমান অবস্থার সংগে খাপখাওয়ানোর ক্ষেত্রে  অসুবিধার জন্য বয়স্কদের ঘুমোতে  সমস্যা হতে পারে এবং খাদ্যে অনীহা আসতে পারে  । তাঁদের মনে অসুস্থতা, এমনকি মৃত্যু নিয়ে দুশ্চিন্তা হতে পরে। ভবিষ্যৎ সম্বন্ধে অনিশ্চয়তা, অসহায় এবং নিরাশ বোধ করা, মনখারাপ হওয়া, উৎসাহ, উদ্যম এবং শক্তি হারিয়ে ফেলা অন্যান্য  মানসিক স্বাস্থ্যের অবনতির লক্ষণ পারে ।  ","বৰ্তমান পৰিস্থিতিৰ লগত নিজকে খাপ-খুৱাবলৈ চেষ্টা কৰোঁতে বয়সস্থ লোকসকলৰ টোপনিত ব্যাঘাত ঘটিব পাৰে আৰু ভোক কমি যাব পাৰে। তেওঁলোক নিজৰ অসুস্থতা আৰু মৃত্যুৰ কথা ভাৱি চিন্তিত হৈ পৰিব পাৰে। ভৱিষ্যতক লৈ শংকা, নৈৰাশ্য আৰু/নাইবা সহায়হীন অনুভৱ কৰা, বিমৰ্ষতা, কোনো বিষয়ৰ প্ৰতি আগ্ৰহ, ৰুচি আৰু উৎসাহ নোহোৱা হোৱা মানসিক স্বাস্থ্যৰ অৱনতিৰ অন্যতম লক্ষণ হ'ব পাৰে।","നിലവിലുള്ള സാഹചര്യങ്ങളെ നേരിടാനുള്ള ഞെരുക്കത്തിൽ പ്രായമായവരുടെ ഭക്ഷണത്തിലുള്ള അഭിരുചി, ഉറങ്ങി ഉണരുന്ന സമയങ്ങൾ തുടങ്ങിയവയിൽ വ്യതിയാനങ്ങൾ ഉണ്ടാകാം . അവർ  അസുഖത്തെ പറ്റിയും മരണത്തെ പറ്റിയും ആശങ്കാകുലരാകാം.   ഭാവിയെക്കുറിച്ചുള്ള ദുരുഹത, നിസ്സഹായത, നിരാശ, ദുഃഖം, ഉത്സാഹമില്ലായ്മ,   താത്പര്യകുറവ്,  ചുറുചുറുക്കില്ലായ്മ  തുടങ്ങിയവയും  മാനിസികാരോഗ്യ  പ്രശ്നങ്ങളുടെ സൂചനകളാവാം.","सध्याच्या ताणाच्या परिस्थितीत शांत झोप न मिळणं आणि भुकेचं तंत्र बिघडणं हे होऊ शकतं. आजारपण आणि मृत्यूच्या विचारांनीही ताण आणि काळजी वाढू शकते. भविष्याबद्दल अनिश्चितता, निराशा, व्याकूळ होणं, उदासी, कशात रस न वाटणं, काही करावसं न वाटणं, सततचा थकवा ही मानसिक ताण आणि अस्वास्थ्याची लक्षणं असू शकतात.","રાતના ઊંઘ ન આવવી, ભૂખ ન લાગવી, ચીડ-ચિડાપણ, ગુસ્સો આવવો, ભૂલી જવું, રડવું આવવું, મૃત્યુને અને માંદા પડવાનો સતત ડર અને મનમાં ગભરાહટ થવી એ લક્ષણો માનસિક તણાવના છે. ",,"ଏହି ପରିସ୍ଥିତିରେ ବୟସ୍କ ଲୋକ ମାନଙ୍କ ଠାରେ ନିଦ୍ରାହୀନତା ଓ ଭୋକ ନଲାଗିବା ଲକ୍ଷଣ ଦେଖା ଯାଇଥାଏ । ସ୍ଵାସ୍ଥ୍ୟହାନୀ ଏବଂ ମୃତ୍ୟୁ କଥା ଭାବି ବ୍ୟସ୍ଥ ହୋଇ ପଡିଥାନ୍ତି । ଏହାଛଡା ଭବିଷ୍ୟତ କଥା ଭାବି ନିରାଶ, ଅସହାୟ, ଦୁଃଖ, ଅନିଛା, ପ୍ରେରଣା ବିହୀନ ଏବଂ ଶକ୍ତିହୀନତା ଇତ୍ୟାଦି ମାନସିକ ଅସୁସ୍ଥତାର ଲକ୍ଷଣ ହୋଇପାରେ |"
4,Q4,What are some signs of depression in the elderly?,"बुज़ुर्ग लोगों में अवसाद या उदासी की कुछ निशानियाँ क्‍या हैं?",ವೃದ್ಧರಲ್ಲಿ ಕಾಣಿಸುವ ಖಿನ್ನತೆಯ ಕೆಲವು ಗುರುತುಗಳೇನು?,வயதானவர்களுக்கு மனச்சோர்வின் சில அறிகுறிகள் யாவை?, వృద్దులలో కృంగదీసే తీవ్ర నిరాశావాదపు లక్షణాలు ఏమి?,,বয়স্কদের অবসাদগ্রস্ত হওয়ার লক্ষণ কী? ,বয়সস্থ লোকৰ ক্ষেত্ৰত বিমৰ্ষতাৰ লক্ষণ কি?,വയോധികരിൽ വിഷാദത്തിന്റെ ലക്ഷണങ്ങൾ എന്തെല്ലാം?,ज्येष्ठामधलं नैराश्य कसं ओळखावं?,જયેષ્ટ નાગરિકોમાં માનસિક તણાવના ચિન્હો કયાં છે ?,,ବୟସ୍କ ବ୍ୟକ୍ତିଙ୍କ ଠାରେ ଦେଖାଯାଉଥିବା ବିଷାଦ ଭାବର ଲକ୍ଷଣ କଣ ଅଟେ ?
4,A4,"Physical symptoms associated with depression among the elderly are tiredness, difficulty in sleeping and changes in appetite. One might also notice other symptoms indicative of mental health concerns, such as irritability, anger, confusion, memory, attention problems, thoughts of dying, and neglect of personal care.","बुज़ुर्ग लोगों में अवसाद या उदासी से जुड़े शारीरिक लक्षणों में थकान लगना, नींद आने में मुश्किल या भूख कम या ज़्यादा लगना शामिल हैं। मानसिक स्‍वास्‍थ्‍य संबंधी चिंताओं की ओर इशारा करने वाले कुछ अन्‍य लक्षण भी दिखाई दे सकते हैं जैसे चिड़चिड़ापन, गुस्‍सा आना, भ्रम में पड़ जाना, याददाश्‍त पर असर, ध्‍यान देने में कठिनाई, मरने के बारे में सोचना और अपनी देखभाल की उपेक्षा करना।
","ಸುಸ್ತು, ನಿದ್ರೆಯ ತೊಂದರೆಗಳು ಮತ್ತು ಹಸಿವಿನ ಬದಲಾವಣೆಗಳು ವೃದ್ಧರಲ್ಲಿ ಖಿನ್ನತೆಗೆ ಸಂಭದಿಸಿದ ದೈಹಿಕ ಲಕ್ಷಣಗಳಾಗಿರುತ್ತವೆ. ಮಾನಸಿಕ ಆರೋಗ್ಯಕ್ಕೆ ಸಂಭದಿಸಿದ ಇತರೆ ರೋಗಲಕ್ಷಣಗಳಾದ ಸಿಡುಕುತನ, ಕೋಪ, ಗೊಂದಲ, ನೆನಪಿನ ಸಮಸ್ಯೆಗಳು, ಗಮನದ ಸಮಸ್ಯೆಗಳು, ಸಾಯುವ ಆಲೋಚನೆಗಳು, ಮತ್ತು ವೈಯಕ್ತಿಕ ಆರೈಕೆಯ ನಿರ್ಲಕ್ಷ್ಯೆಗಳನ್ನೂ ಕೂಡ ಗಮನಿಸಬಹುದು.","வயதானவர்களிடையே மனச்சோர்வுடன் தொடர்புடைய உடல் அறிகுறிகள் சோர்வு, தூங்குவதில் சிரமம் மற்றும் பசியின்மை ஆகியவை ஆகும். எரிச்சல், கோபம், குழப்பம், நினைவகம், கவனக்குறைவு பிரச்சினைகள், இறக்கும் எண்ணங்கள் மற்றும் தனிப்பட்ட கவனிப்பை புறக்கணித்தல் போன்ற மனநல கவலைகளை பிற அறிகுறிகளாக ஒருவர் கவனிக்கலாம்.","మానసిక నిరాశావాదo యొక్క కొన్ని భౌతిక లక్షణములలో ఎక్కువగా అలసిపోవడము, నిద్రలో భంగం కలగటం, ఆకలి తగ్గిపోవటం ఉంటాయి. ఇతర మానసిక సమస్యలను తెలిపే చిహ్నాలలో తొందరగా కోపం రావటమూ, విసుగుదల ఎక్కువగా ప్రదర్శించడమూ, తత్తరపాటు తో గాబరాగా ఉండటమూ , మరణం గురించి ఎక్కువగా ఆలోచించడమూ, తమ బాగోగులు చూసుకోక పోవడం కూడా ఉంటాయి. ",,"বয়স্কের অবসাদগ্রস্ত হওয়ার শারীরিক লক্ষণ হলো ক্লান্তি, ঘুমের অভাব, এবং রুচির পরিবর্তন। এছাড়া মানসিক স্বাস্থ্যের অবনতির কিছু লক্ষণও থাকতে পারে, যেমন, খিটখিটে মেজাজ, রাগ, দ্বিধাগ্রস্ত মন, স্মৃতি এবং সজাগ থাকা নিয়ে অসুবিধে, মৃত্যুর চিন্তা এবং নিজের দিকে খেয়াল রাখার ব্যাপারে অনিচ্ছা।  ","বয়সস্থ লোকৰ বিমৰ্ষতাৰ লগত জড়িত শাৰীৰিক লক্ষণসমূহৰ ভিতৰত ভাগৰ লগা, টোপনিত ব্যাঘাত আৰু ভোকৰ পৰিবৰ্তন আদি অন্যতম। মানসিক স্ৱাস্থ্যৰ অৱনতিৰ লক্ষণ হিচাপে বিৰক্তি, খং, বিমূঢ়তা, স্মৃতি আৰু মনোযোগৰ সমস্যা, মৃত্যুৰ ভয় আৰু নিজৰ স্বাস্থ্যৰ প্ৰতি অৱহেলা আদিও দেখা যাব পাৰে।","ക്ഷീണം, ഉറക്കമില്ലായ്മ, ഭക്ഷണത്തോടുള്ള അഭിരുചിയിൽ മാറ്റങ്ങൾ എന്നിവ വിഷാദാത്തോടനുബന്ധിച്ചു കാണാവുന്ന ശാരീരിക ലക്ഷണങ്ങളാണ്. ക്ഷോഭം, ദേഷ്യം, ആശയകുഴപ്പം, ഓർമയില്ലായ്മ , ശ്രദ്ധക്കുറവ് , മരണത്തെക്കുറിച്ചുള്ള ചിന്ത, സ്വന്തം പരിരക്ഷയോടുള്ള അവഗണന തുടങ്ങിയ മാനസികമായ ലക്ഷണങ്ങളും കണ്ടേക്കാം.","नैराश्याची शारीरिक लक्षणं सतत थकवा, भुकेचं चक्र बदलणं आणि झोप न येणं ही असू शकतात. मुख्य मानसिक लक्षणांमधे त्रासिकपणा, राग, मनाचा गोंधळ किंवा हरवल्यासारखं होणं, स्मृती कमी होणं, लक्ष न लागणं, मन एकाग्र करता न येणं, मृत्यूचे विचार सतत येत राहणं, आणि आपली योग्य ती काळजी आपली आपण घेता न येणं ही आहेत.","જયેષ્ટ નાગરિકોમાં  માનસિક તણાવ સાથે સંકળાયેલા શારીરિક લક્ષણો એટલે થાક,ઊંઘવામાં  મુશ્કેલી અને ભૂખમાં ફેરફાર. માનસિક સ્વાસ્થ્યની ચિંતાઓના સંકેત આપતા અન્ય લક્ષણો પણ કોઈને નોંધાય છે, જેમ કે ચીડિયાપણું, ક્રોધ, મૂંઝવણ, યાદશક્તિ, ધ્યાનની સમસ્યાઓ, મરી જવાના વિચારો અને વ્યક્તિગત કાળજીની અવગણના.",,"କ୍ଲାନ୍ତ ଭାବ, ଶୋଇବାରେ ଅସୁବିଧା ହେବା ଏବଂ ଭୋକ ନଲାଗିବା ବୟସ୍କ ଲୋକଙ୍କ ଠାରେ ବିଷାଦ ଭାବର ଶାରୀରିକ ଲକ୍ଷଣ ଅଟେ । ଏହା ସହିତ ମାନସିକ ଅସୁସ୍ଥତାର ଅନ୍ୟ ଲକ୍ଷଣବି ଦେଖାଯାଇ ପାରେ, ଯେପରିକି ଚିଡ଼ା ପ୍ରକୃତି, ରାଗ, ବିଶୃଙ୍ଖଳା, କୌଣସି କଥାରେ ମନ ନଲାଗିବା, ମୃତ୍ୟୁ ବିଷୟରେ ଭାବିବା ଏବଂ ନିଜର ଯତ୍ନ ନନେବା । "
5,Q5,When should one get  professional help?,"पेशेवर मदद कब लेनी चाहिए?",ಯಾವಾಗ ವೈದ್ಯಕೀಯ ಸಹಾಯ ಪಡೆಯಬೇಕು?,ஒருவர் எப்போது தொழில்முறை உதவி பெற வேண்டும்?,ఎప్పుడు నిపుణుల సహాయం తీసుకోవాలి?,,কখন পেশাদার ডাক্তারের সংগে যোগাযোগ  করা উচিত? ,বৃত্তিগত সহায়কাৰীৰ সাহায্য কেতিয়া লোৱা উচিত?,എപ്പോഴാണ് വിദഗ്ദ്ധ സഹായം തേടേണ്ടത്?,तज्ज्ञाची मदत केव्हा घ्यावी?,કોઈએ તજ્ઞની  સહાય ક્યારે મેળવવી જોઈએ?,,କେତେବେଳେ ଭାରସାମ୍ୟ ହଠାତ୍ ଜଣେ ବିଶେଷଜ୍ଞଙ୍କ ସାହାଯ୍ୟ ନେବା ଜରୁରୀ ଅଟେ ?
